{
  "name": "Path of the Wild Heart",
  "class": "Barbarian",
  "description": "Barbarians who follow the Path of the Wild Heart view themselves as kin to animals. These Barbarians learn magical means to communicate with animals, and their Rage heightens their connection to animals as it fills them with supernatural might.",
  "source": "Player's Handbook 2024",
  "features_by_level": {
    "3": {
      "Animal Speaker": {
        "description": "You can cast the Beast Sense and Speak with Animals spells but only as Rituals. Wisdom is your spellcasting ability for them.",
        "effects": [
          {"type": "grant_spell", "spell": "Beast Sense", "spell_list": "Barbarian"},
          {"type": "grant_spell", "spell": "Speak with Animals", "spell_list": "Barbarian"}
        ]
      },
      "Rage of the Wilds": "Your Rage taps into the primal power of animals. Whenever you activate your Rage, you gain one of the following options of your choice. Bear: While your Rage is active, you have Resistance to every damage type except Force, Necrotic, Psychic, and Radiant. Eagle: When you activate your Rage, you can take the Disengage and Dash actions as part of that Bonus Action. While your Rage is active, you can take a Bonus Action to take both of those actions. Wolf: While your Rage is active, your allies have Advantage on attack rolls against any enemy of yours within 5 feet of you."
    },
    "6": {
      "Aspect of the Wilds": {
        "description": "You gain one of the following options of your choice. Whenever you finish a Long Rest, you can change your choice.",
        "choices": {
          "type": "select_single",
          "count": 1,
          "name": "aspect_of_the_wilds",
          "source": {
            "type": "fixed_list",
            "options": ["Owl", "Panther", "Salmon"]
          }
        },
        "options": {
          "Owl": "You have Darkvision with a range of 60 feet. If you already have Darkvision, its range increases by 60 feet.",
          "Panther": "You have a Climb Speed equal to your Speed.",
          "Salmon": "You have a Swim Speed equal to your Speed."
        }
      }
    },
    "10": {
      "Nature Speaker": {
        "description": "You can cast the Commune with Nature spell but only as a Ritual. Wisdom is your spellcasting ability for it.",
        "effects": [
          {"type": "grant_spell", "spell": "Commune with Nature", "spell_list": "Barbarian"}
        ]
      }
    },
    "14": {
      "Power of the Wilds": "Whenever you activate your Rage, you gain one of the following options of your choice. Falcon: While your Rage is active, you have a Fly Speed equal to your Speed if you aren't wearing any armor. Lion: While your Rage is active, any of your enemies within 5 feet of you have Disadvantage on attack rolls against targets other than you or another Barbarian who has this option active. Ram: While your Rage is active, you can cause a Large or smaller creature to have the Prone condition when you hit it with a melee attack."
    }
  }
}