{
  "name": "The Celestial",
  "class": "Warlock",
  "description": "Your pact draws on the Upper Planes, the realms of everlasting bliss. You might enter an agreement with an empyrean, a couatl, a sphinx, a unicorn, or another heavenly entity. Or you might call on numerous such beings as you pursue goals aligned with theirs. Your pact allows you to experience a hint of the holy light that illuminates the multiverse.",
  "source": "Player's Handbook 2024",
  "features_by_level": {
    "3": {
      "Celestial Spells": {
        "description": "The magic of your patron ensures you always have certain spells ready; when you reach a Warlock level specified in the Celestial Spells table, you thereafter always have the listed spells prepared.",
        "spells": {
          "3": ["Light", "Sacred Flame", "Aid", "Cure Wounds", "Guiding Bolt", "Lesser Restoration"],
          "5": ["Daylight", "Revivify"],
          "7": ["Guardian of Faith", "Wall of Fire"],
          "9": ["Greater Restoration", "Summon Celestial"]
        },
        "effects": [
          {"type": "grant_cantrip", "spell": "Light", "counts_against_limit": false},
          {"type": "grant_cantrip", "spell": "Sacred Flame", "counts_against_limit": false},
          {"type": "grant_spell", "spell": "Aid", "min_level": 3, "counts_against_limit": false},
          {"type": "grant_spell", "spell": "Cure Wounds", "min_level": 3, "counts_against_limit": false},
          {"type": "grant_spell", "spell": "Guiding Bolt", "min_level": 3, "counts_against_limit": false},
          {"type": "grant_spell", "spell": "Lesser Restoration", "min_level": 3, "counts_against_limit": false},
          {"type": "grant_spell", "spell": "Daylight", "min_level": 5, "counts_against_limit": false},
          {"type": "grant_spell", "spell": "Revivify", "min_level": 5, "counts_against_limit": false},
          {"type": "grant_spell", "spell": "Guardian of Faith", "min_level": 7, "counts_against_limit": false},
          {"type": "grant_spell", "spell": "Wall of Fire", "min_level": 7, "counts_against_limit": false},
          {"type": "grant_spell", "spell": "Greater Restoration", "min_level": 9, "counts_against_limit": false},
          {"type": "grant_spell", "spell": "Summon Celestial", "min_level": 9, "counts_against_limit": false}
        ]
      },
      "Healing Light": "You gain the ability to channel celestial energy to heal wounds. You have a pool of d6s to fuel this healing. The number of dice in the pool equals 1 plus your Warlock level.\n\nAs a Bonus Action, you can heal yourself or one creature you can see within 60 feet of yourself, expending dice from the pool. The maximum number of dice you can expend at once equals your Charisma modifier (minimum of one die). Roll the dice you expend, and restore a number of Hit Points equal to the roll's total. Your pool regains all expended dice when you finish a Long Rest."
    },
    "6": {
      "Radiant Soul": {
        "description": "Your link to your patron allows you to serve as a conduit for radiant energy. You have Resistance to Radiant damage. Once per turn, when a spell you cast deals Radiant or Fire damage, you can add your Charisma modifier to that spell's damage against one of the spell's targets.",
        "effects": [
          {"type": "grant_damage_resistance", "damage_type": "Radiant"}
        ]
      }
    },
    "10": {
      "Celestial Resilience": "You gain Temporary Hit Points whenever you use your Magical Cunning feature or finish a Short or Long Rest. These Temporary Hit Points equal your Warlock level plus your Charisma modifier. Additionally, choose up to five creatures you can see when you gain the points. Those creatures each gain Temporary Hit Points equal to half your Warlock level plus your Charisma modifier."
    },
    "14": {
      "Searing Vengeance": "When you or an ally within 60 feet of you is about to make a Death Saving Throw, you can unleash radiant energy to save the creature. The creature regains Hit Points equal to half its Hit Point maximum and can end the Prone condition on itself. Each creature of your choice that is within 30 feet of the creature takes Radiant damage equal to 2d8 plus your Charisma modifier, and each has the Blinded condition until the end of the current turn.\n\nOnce you use this feature, you can't use it again until you finish a Long Rest."
    }
  }
}
